{"args":{"catalog":"artifacts/p2/governed-catalog.json","decisionLedger":"artifacts/p4/surfaceops-decision-ledger.json","evaluationReport":"artifacts/p4/judgmentkit-evaluation-report.json","fixture":"fixtures/designer-workflow-trace","ingestionEvidence":"artifacts/p2/evidence.json","ingestionReport":"artifacts/p2/ingestion-report.json","nativeEvidence":"artifacts/p5/native/evidence.json","orchestrationEvidence":"artifacts/p3/evidence.json","out":"artifacts/designer-workflow-trace","protocolEvidence":"artifacts/p5/protocol/evidence.json","reviewEvidence":"artifacts/p4/evidence.json","reviewQueue":"artifacts/p3/review-queue.json","reviewReport":"artifacts/p4/review-judgment-report.json","sourceAuthorityMap":"artifacts/source-conformance/source-authority-map.json","sourceConformanceEvidence":"artifacts/source-conformance/evidence.json","sourceConformanceReport":"artifacts/source-conformance/source-conformance-report.json","sourceReviewQueue":"artifacts/source-conformance/source-review-queue.json"},"artifacts":[{"hash":"0000000000000000000000000000000000000000000000000000000000000000","hashAlgorithm":"sha256","path":"artifacts/designer-workflow-trace/designer-workflow-trace-report.json","provenance":{"generatedAt":"1970-01-01T00:00:00.000Z","generator":"interfacectl-designer-workflow-trace-materialize","sourceRefs":["fixture://designer-workflow-trace/mutations/hash-mismatch"]},"schemaId":"designer-workflow-trace-report.v0","sourceRef":null}],"boundaryRefs":[],"checkedAt":"1970-01-01T00:00:00.000Z","command":"interfacectl surfaces designer-workflow-trace proof","contractId":"surfaces-designer-workflow-trace-proof","diagnostics":[],"diagnosticsRegistry":[{"artifactPath":"fixtures/designer-workflow-trace/mutations/missing-upstream-evidence.designer-workflow-trace-preflight.json","canonicalMessage":"Designer workflow trace upstream evidence is missing.","code":"TRACE_UPSTREAM_EVIDENCE_MISSING","diagnosticSource":"designer-workflow-trace-preflight-validator","fixtureCoverage":"mutations/missing-upstream-evidence.designer-workflow-trace-preflight.json","jsonPointer":"/boundaryRefs","phase":"designer-workflow-trace-preflight","promotionStatus":"blocked","severity":"error","sourceRef":null,"stage":"preflight","suggestedAction":"Restore accepted P2, source-conformance, P3, P4, protocol, and native evidence before regenerating the trace.","trigger":"Required designer workflow trace evidence or artifact input is missing","validationResult":"invalid"},{"artifactPath":"fixtures/designer-workflow-trace/mutations/upstream-hash-mismatch.designer-workflow-trace-preflight.json","canonicalMessage":"Designer workflow trace upstream evidence or artifact hash does not match accepted evidence.","code":"TRACE_UPSTREAM_EVIDENCE_HASH_MISMATCH","diagnosticSource":"designer-workflow-trace-preflight-validator","fixtureCoverage":"mutations/upstream-hash-mismatch.designer-workflow-trace-preflight.json","jsonPointer":"/boundaryRefs/0/hash","phase":"designer-workflow-trace-preflight","promotionStatus":"blocked","severity":"error","sourceRef":null,"stage":"preflight","suggestedAction":"Restore accepted P2, source-conformance, P3, P4, protocol, and native evidence before regenerating the trace.","trigger":"Required designer workflow trace evidence or artifact hash does not match the accepted boundary","validationResult":"invalid"},{"artifactPath":"fixtures/designer-workflow-trace/invalid/unknown-component.designer-workflow-trace.json","canonicalMessage":"Designer workflow trace fixture references a component outside the selected trace scope.","code":"TRACE_COMPONENT_OUT_OF_SCOPE","diagnosticSource":"designer-workflow-trace-validator","fixtureCoverage":"invalid/unknown-component.designer-workflow-trace.json","jsonPointer":"/componentId","phase":"designer-workflow-trace-fixture","promotionStatus":"blocked","severity":"error","sourceRef":"fixture://designer-workflow-trace/invalid/unknown-component#/componentId","stage":"trace-validation","suggestedAction":"Keep the first designer workflow trace scoped to the accepted Button catalog component.","trigger":"Trace fixture references a component outside the selected scenario scope","validationResult":"invalid"},{"artifactPath":"fixtures/designer-workflow-trace/invalid/missing-target-handoff.designer-workflow-trace.json","canonicalMessage":"Designer workflow trace fixture omits a required target handoff.","code":"TRACE_HANDOFF_TARGET_MISSING","diagnosticSource":"designer-workflow-trace-handoff-validator","fixtureCoverage":"invalid/missing-target-handoff.designer-workflow-trace.json","jsonPointer":"/targetIds","phase":"designer-workflow-trace-fixture","promotionStatus":"blocked","severity":"error","sourceRef":"fixture://designer-workflow-trace/invalid/missing-target-handoff#/targetIds","stage":"target-handoff","suggestedAction":"Keep both implemented static handoff targets in the trace fixture.","trigger":"Trace fixture omits a required target handoff","validationResult":"invalid"},{"artifactPath":"fixtures/designer-workflow-trace/review/review-required-status.designer-workflow-trace.json","canonicalMessage":"Designer workflow trace preserves review-required or blocked status as indexed evidence.","code":"TRACE_REVIEW_REQUIRED_STATUS_INDEXED","diagnosticSource":"designer-workflow-trace-status-indexer","fixtureCoverage":"review/review-required-status.designer-workflow-trace.json","jsonPointer":"/requiresReviewStatus","phase":"designer-workflow-trace-fixture","promotionStatus":"review_required","severity":"review","sourceRef":"fixture://designer-workflow-trace/review/review-required-status#/requiresReviewStatus","stage":"status-index","suggestedAction":"Preserve review-required and blocked statuses as indexed evidence.","trigger":"Trace fixture requires review-required and blocked status to remain visible in the index","validationResult":"review_required"},{"artifactPath":"fixtures/designer-workflow-trace/invalid/source-conformance-review-expired.designer-workflow-trace.json","canonicalMessage":"Designer workflow trace indexes expired source-conformance review metadata as blocked evidence.","code":"TRACE_SOURCE_CONFORMANCE_REVIEW_EXPIRED_INDEXED","diagnosticSource":"designer-workflow-trace-status-indexer","fixtureCoverage":"invalid/source-conformance-review-expired.designer-workflow-trace.json","jsonPointer":"/sourceConformanceReviewStatus","phase":"designer-workflow-trace-fixture","promotionStatus":"blocked","severity":"error","sourceRef":"fixture://designer-workflow-trace/invalid/source-conformance-review-expired#/sourceConformanceReviewStatus","stage":"status-index","suggestedAction":"Preserve review-required and blocked statuses as indexed evidence.","trigger":"Trace fixture requires expired source-conformance review metadata to remain visible in the index","validationResult":"invalid"},{"artifactPath":"fixtures/designer-workflow-trace/invalid/forbidden-claim.designer-workflow-trace.json","canonicalMessage":"Designer workflow trace fixtures cannot claim product workflow implementation, customer validation, production adoption, live integrations, live agent execution, tool calls, network calls, callbacks, secrets, action execution, work-order execution, production adapters, APIs, SDKs, runtimes, A2UI, P6, or P7.","code":"TRACE_FORBIDDEN_CLAIM","diagnosticSource":"designer-workflow-trace-claim-boundary","fixtureCoverage":"invalid/forbidden-claim.designer-workflow-trace.json","jsonPointer":"/claims","phase":"designer-workflow-trace-fixture","promotionStatus":"blocked","severity":"error","sourceRef":null,"stage":"claim-boundary","suggestedAction":"Keep the trace proof-only; add a target proof before claiming live or production behavior.","trigger":"Trace fixture claims product workflow implementation, customer validation, production adoption, live behavior, live agent or work-order execution, A2UI, P6, or P7","validationResult":"invalid"},{"artifactPath":"fixtures/designer-workflow-trace/mutations/hash-mismatch.designer-workflow-trace-evidence.json","canonicalMessage":"Designer workflow trace evidence hash does not match generated artifacts.","code":"TRACE_EVIDENCE_HASH_MISMATCH","diagnosticSource":"designer-workflow-trace-evidence-validator","fixtureCoverage":"mutations/hash-mismatch.designer-workflow-trace-evidence.json","jsonPointer":"/artifacts/0/hash","phase":"designer-workflow-trace-evidence","promotionStatus":"blocked","severity":"error","sourceRef":null,"stage":"evidence","suggestedAction":"Regenerate designer workflow trace artifacts from accepted evidence.","trigger":"Designer workflow trace evidence hash differs from generated artifacts","validationResult":"invalid"}],"environment":{"generatedAt":"1970-01-01T00:00:00.000Z","host":null},"fixtureRefs":[],"promotionStatus":"blocked","provenance":{"generatedAt":"1970-01-01T00:00:00.000Z","generator":"interfacectl-designer-workflow-trace-materialize","sourceRefs":["fixture://designer-workflow-trace/mutations/hash-mismatch"]},"runId":"designer-workflow-trace-mutation","schemaClosure":[],"schemaId":"designer-workflow-trace-evidence.v0","status":"pass","validationResults":[],"version":"0.0.0"}